[
  {
    "slug": "master-guide-chatgpt",
    "platform": "chatgpt",
    "group": "master",
    "title": "ChatGPT Master Guide",
    "sub": "",
    "file": "chatgpt/master-guide-chatgpt.html",
    "order": 0
  },
  {
    "slug": "chatgpt-101-user-guide",
    "platform": "chatgpt",
    "group": "core",
    "title": "101",
    "sub": "",
    "file": "chatgpt/chatgpt-101-user-guide.html",
    "order": 10
  },
  {
    "slug": "chatgpt-advanced-reasoning-user-guide",
    "platform": "chatgpt",
    "group": "core",
    "title": "Advanced Reasoning",
    "sub": "",
    "file": "chatgpt/chatgpt-advanced-reasoning-user-guide.html",
    "order": 20
  },
  {
    "slug": "chatgpt-gpts-custom-assistants-user-guide",
    "platform": "chatgpt",
    "group": "core",
    "title": "GPTs Custom Assistants",
    "sub": "",
    "file": "chatgpt/chatgpt-gpts-custom-assistants-user-guide.html",
    "order": 30
  },
  {
    "slug": "chatgpt-memory-custom-instructions-user-guide",
    "platform": "chatgpt",
    "group": "core",
    "title": "Memory Custom Instructions",
    "sub": "",
    "file": "chatgpt/chatgpt-memory-custom-instructions-user-guide.html",
    "order": 40
  },
  {
    "slug": "chatgpt-projects-user-guide",
    "platform": "chatgpt",
    "group": "core",
    "title": "Projects",
    "sub": "",
    "file": "chatgpt/chatgpt-projects-user-guide.html",
    "order": 50
  },
  {
    "slug": "chatgpt-prompt-guide-user-guide",
    "platform": "chatgpt",
    "group": "core",
    "title": "Prompt Guide",
    "sub": "",
    "file": "chatgpt/chatgpt-prompt-guide-user-guide.html",
    "order": 60
  },
  {
    "slug": "chatgpt-research-web-search-user-guide",
    "platform": "chatgpt",
    "group": "core",
    "title": "Research Web Search",
    "sub": "",
    "file": "chatgpt/chatgpt-research-web-search-user-guide.html",
    "order": 70
  },
  {
    "slug": "chatgpt-voice-vision-files-user-guide",
    "platform": "chatgpt",
    "group": "core",
    "title": "Voice Vision Files",
    "sub": "",
    "file": "chatgpt/chatgpt-voice-vision-files-user-guide.html",
    "order": 80
  },
  {
    "slug": "chatgpt-workflows-user-guide",
    "platform": "chatgpt",
    "group": "core",
    "title": "Workflows",
    "sub": "",
    "file": "chatgpt/chatgpt-workflows-user-guide.html",
    "order": 90
  },
  {
    "slug": "chatgpt-writing-editing-user-guide",
    "platform": "chatgpt",
    "group": "core",
    "title": "Writing Editing",
    "sub": "",
    "file": "chatgpt/chatgpt-writing-editing-user-guide.html",
    "order": 100
  },
  {
    "slug": "gpt-user-guide",
    "platform": "chatgpt",
    "group": "core",
    "title": "GPT",
    "sub": "",
    "file": "chatgpt/gpt-user-guide.html",
    "order": 110
  },
  {
    "slug": "chatgpt-actions",
    "platform": "chatgpt",
    "group": "topical",
    "title": "Actions",
    "sub": "",
    "file": "chatgpt/chatgpt-actions.html",
    "order": 10
  },
  {
    "slug": "chatgpt-api-basics-for-non-developers",
    "platform": "chatgpt",
    "group": "topical",
    "title": "API Basics For Non Developers",
    "sub": "",
    "file": "chatgpt/chatgpt-api-basics-for-non-developers.html",
    "order": 20
  },
  {
    "slug": "chatgpt-canvas",
    "platform": "chatgpt",
    "group": "topical",
    "title": "Canvas",
    "sub": "",
    "file": "chatgpt/chatgpt-canvas.html",
    "order": 30
  },
  {
    "slug": "chatgpt-custom-instructions",
    "platform": "chatgpt",
    "group": "topical",
    "title": "Custom Instructions",
    "sub": "",
    "file": "chatgpt/chatgpt-custom-instructions.html",
    "order": 40
  },
  {
    "slug": "chatgpt-customer-facing-use",
    "platform": "chatgpt",
    "group": "topical",
    "title": "Customer Facing Use",
    "sub": "",
    "file": "chatgpt/chatgpt-customer-facing-use.html",
    "order": 50
  },
  {
    "slug": "chatgpt-for-content-and-social-media",
    "platform": "chatgpt",
    "group": "topical",
    "title": "For Content And Social Media",
    "sub": "",
    "file": "chatgpt/chatgpt-for-content-and-social-media.html",
    "order": 60
  },
  {
    "slug": "chatgpt-for-data-analysis",
    "platform": "chatgpt",
    "group": "topical",
    "title": "For Data Analysis",
    "sub": "",
    "file": "chatgpt/chatgpt-for-data-analysis.html",
    "order": 70
  },
  {
    "slug": "chatgpt-for-meeting-prep-and-follow-up",
    "platform": "chatgpt",
    "group": "topical",
    "title": "For Meeting Prep And Follow Up",
    "sub": "",
    "file": "chatgpt/chatgpt-for-meeting-prep-and-follow-up.html",
    "order": 80
  },
  {
    "slug": "chatgpt-image-generation",
    "platform": "chatgpt",
    "group": "topical",
    "title": "Image Generation",
    "sub": "",
    "file": "chatgpt/chatgpt-image-generation.html",
    "order": 90
  },
  {
    "slug": "chatgpt-operator-mode-and-system-prompts",
    "platform": "chatgpt",
    "group": "topical",
    "title": "Operator Mode And System Prompts",
    "sub": "",
    "file": "chatgpt/chatgpt-operator-mode-and-system-prompts.html",
    "order": 100
  },
  {
    "slug": "chatgpt-team-and-enterprise-plan-guide",
    "platform": "chatgpt",
    "group": "topical",
    "title": "Team And Enterprise Plan Guide",
    "sub": "",
    "file": "chatgpt/chatgpt-team-and-enterprise-plan-guide.html",
    "order": 110
  },
  {
    "slug": "chatgpt-vs-other-tools",
    "platform": "chatgpt",
    "group": "topical",
    "title": "vs Other Tools",
    "sub": "",
    "file": "chatgpt/chatgpt-vs-other-tools.html",
    "order": 120
  },
  {
    "slug": "master-guide-claude",
    "platform": "claude",
    "group": "master",
    "title": "Claude Master Guide",
    "sub": "",
    "file": "claude/master-guide-claude.html",
    "order": 0
  },
  {
    "slug": "claude-101-user-guide",
    "platform": "claude",
    "group": "core",
    "title": "101",
    "sub": "",
    "file": "claude/claude-101-user-guide.html",
    "order": 10
  },
  {
    "slug": "claude-agents-user-guide",
    "platform": "claude",
    "group": "core",
    "title": "Agents",
    "sub": "",
    "file": "claude/claude-agents-user-guide.html",
    "order": 20
  },
  {
    "slug": "claude-api-basics-user-guide",
    "platform": "claude",
    "group": "core",
    "title": "API Basics",
    "sub": "",
    "file": "claude/claude-api-basics-user-guide.html",
    "order": 30
  },
  {
    "slug": "claude-code-user-guide",
    "platform": "claude",
    "group": "core",
    "title": "Code",
    "sub": "",
    "file": "claude/claude-code-user-guide.html",
    "order": 40
  },
  {
    "slug": "claude-cowork-user-guide",
    "platform": "claude",
    "group": "core",
    "title": "Cowork",
    "sub": "",
    "file": "claude/claude-cowork-user-guide.html",
    "order": 50
  },
  {
    "slug": "claude-memory-context-user-guide",
    "platform": "claude",
    "group": "core",
    "title": "Memory Context",
    "sub": "",
    "file": "claude/claude-memory-context-user-guide.html",
    "order": 60
  },
  {
    "slug": "claude-multimodal-user-guide",
    "platform": "claude",
    "group": "core",
    "title": "Multimodal",
    "sub": "",
    "file": "claude/claude-multimodal-user-guide.html",
    "order": 70
  },
  {
    "slug": "claude-projects-user-guide",
    "platform": "claude",
    "group": "core",
    "title": "Projects",
    "sub": "",
    "file": "claude/claude-projects-user-guide.html",
    "order": 80
  },
  {
    "slug": "claude-prompt-engineering-user-guide",
    "platform": "claude",
    "group": "core",
    "title": "Prompt Engineering",
    "sub": "",
    "file": "claude/claude-prompt-engineering-user-guide.html",
    "order": 90
  },
  {
    "slug": "claude-workflows-user-guide",
    "platform": "claude",
    "group": "core",
    "title": "Workflows",
    "sub": "",
    "file": "claude/claude-workflows-user-guide.html",
    "order": 100
  },
  {
    "slug": "claude-cowork-mode",
    "platform": "claude",
    "group": "topical",
    "title": "Cowork Mode",
    "sub": "",
    "file": "claude/claude-cowork-mode.html",
    "order": 10
  },
  {
    "slug": "claude-for-coding-assistance",
    "platform": "claude",
    "group": "topical",
    "title": "For Coding Assistance",
    "sub": "",
    "file": "claude/claude-for-coding-assistance.html",
    "order": 20
  },
  {
    "slug": "claude-for-data-extraction-and-document-processing",
    "platform": "claude",
    "group": "topical",
    "title": "For Data Extraction And Document Processing",
    "sub": "",
    "file": "claude/claude-for-data-extraction-and-document-processing.html",
    "order": 30
  },
  {
    "slug": "claude-for-internal-knowledge-base-building",
    "platform": "claude",
    "group": "topical",
    "title": "For Internal Knowledge Base Building",
    "sub": "",
    "file": "claude/claude-for-internal-knowledge-base-building.html",
    "order": 40
  },
  {
    "slug": "claude-for-sensitive-and-nuanced-business-writing",
    "platform": "claude",
    "group": "topical",
    "title": "For Sensitive And Nuanced Business Writing",
    "sub": "",
    "file": "claude/claude-for-sensitive-and-nuanced-business-writing.html",
    "order": 50
  },
  {
    "slug": "claude-for-systems-thinking-and-strategic-planning",
    "platform": "claude",
    "group": "topical",
    "title": "For Systems Thinking And Strategic Planning",
    "sub": "",
    "file": "claude/claude-for-systems-thinking-and-strategic-planning.html",
    "order": 60
  },
  {
    "slug": "claude-for-writing-editing-and-tone-refinement",
    "platform": "claude",
    "group": "topical",
    "title": "For Writing Editing And Tone Refinement",
    "sub": "",
    "file": "claude/claude-for-writing-editing-and-tone-refinement.html",
    "order": 70
  },
  {
    "slug": "claude-safety-and-refusals",
    "platform": "claude",
    "group": "topical",
    "title": "Safety And Refusals",
    "sub": "",
    "file": "claude/claude-safety-and-refusals.html",
    "order": 80
  },
  {
    "slug": "master-guide-gemini",
    "platform": "gemini",
    "group": "master",